{
  "apiVersion": "https://example.invalid/issueready/locale-bundle/v1alpha1",
  "kind": "LocaleBundle",
  "locale": "en",
  "revision": 1,
  "messages": {
    "rules.definition.concrete-object-action": "The task identifies a concrete work object and action.",
    "rules.definition.independent-restatement": "The requested problem or change can be restated without inventing requirements.",
    "rules.definition.decisive-ambiguity": "No unresolved ambiguity changes the implementation decision.",
    "rules.definition.implementation-contradiction": "The included sources do not contradict one another on implementation-relevant facts.",
    "rules.scope.primary-delivery-goal": "The task has one primary delivery goal; supporting steps are not treated as separate goals.",
    "rules.scope.independent-delivery-goals": "The task does not combine independently deliverable goals with separate acceptance conditions.",
    "rules.scope.cross-boundary-contract": "Required cross-repository or service boundaries are defined.",
    "rules.acceptance.observable-completion": "The task includes observable and falsifiable completion conditions.",
    "rules.acceptance.goal-aligned-acceptance": "Acceptance conditions verify the requested outcome rather than generic success.",
    "rules.validation.applicable-validation": "An applicable validation method is stated, or validation is explicitly not applicable.",
    "rules.behavior.critical-edge-behavior": "Critical error and boundary behavior is specified or explicitly not applicable.",
    "rules.bug.observed-versus-expected": "Observed behavior is distinguished from expected behavior.",
    "rules.bug.bounded-reproduction": "Reproduction evidence or a clear non-reproducibility constraint is provided.",
    "rules.context.navigation-hint": "A searchable file, module, API, symbol, or component hint is available.",
    "rules.context.environment-prerequisites": "Implementation-relevant environment, version, configuration, and prerequisites are defined.",
    "rules.context.essential-context-available": "Essential referenced context is present or explicitly accessible.",
    "rules.dependency.dependency-contract": "Implementation-relevant dependency versions and contract boundaries are defined.",
    "rules.compatibility.migration-boundary": "Preserved behavior, changed behavior, and migration boundaries are defined where applicable.",
    "rules.quality.performance-measurement": "Performance work identifies a workload and measurement method.",
    "rules.delegation-policy.repository-delegation-boundary": "Repository policy determines candidate, supervised, or human-only delegation independently of spec readiness.",
    "rules.traceability.resolvable-reference": "Required internal issue, pull request, or specification references are resolvable.",
    "rules.freshness.current-dependency-state": "Version and dependency assumptions are current enough for the requested work.",
    "rules.coherence.cross-dimension-coherence": "Problem, scope, acceptance, and validation evidence are mutually coherent.",
    "rules.input-integrity.snapshot-evaluation-integrity": "The normalized snapshot and evaluator coverage are complete enough to support a conclusion.",
    "task-packs.generic.name": "Generic task",
    "task-packs.bug.name": "Bug",
    "task-packs.feature.name": "Feature",
    "task-packs.docs.name": "Documentation",
    "task-packs.dependency.name": "Dependency change",
    "task-packs.refactor.name": "Refactor",
    "task-packs.test-ci.name": "Test or CI",
    "task-packs.operations.name": "Operations",
    "task-packs.generic.non-requirements.complete-technical-design": "A complete technical design is not required by the generic pack.",
    "task-packs.bug.non-requirements.known-root-cause": "A known root cause is not required for a bug report.",
    "task-packs.bug.non-requirements.screenshot": "A screenshot is not required when other evidence is sufficient.",
    "task-packs.feature.non-requirements.exact-file-paths": "Exact implementation file paths are not required for a feature request.",
    "task-packs.feature.non-requirements.complete-technical-design": "A complete technical design is not required for a feature request.",
    "task-packs.docs.non-requirements.unit-tests": "Unit tests are not automatically required for documentation work.",
    "task-packs.docs.non-requirements.runtime-environment": "A runtime environment is not required when it is irrelevant to the documentation change.",
    "task-packs.dependency.non-requirements.long-problem-statement": "A long problem statement is not required when the dependency boundary is explicit.",
    "task-packs.refactor.non-requirements.user-interface-change": "A user-interface change is not required for a refactor.",
    "task-packs.test-ci.non-requirements.product-user-story": "A product user story is not required for test or CI maintenance.",
    "task-packs.operations.non-requirements.autonomous-execution-authorization": "Task readiness does not grant authorization for autonomous operational execution."
  }
}
